{
  "$schema": "https://json-schema.org/draft/2020-12/schema",
  "$id": "https://github.com/LederWorks/veiled-market/blob/main/schemas/registry.schema.json",
  "title": "veiled-market Resource Registry",
  "description": "Tracks every evaluated resource by source marketplace, plugin reference, and file path. Used to avoid redundant re-evaluation of unchanged content across discovery runs.",
  "type": "object",
  "required": ["_schema_version", "marketplaces"],
  "additionalProperties": false,
  "properties": {
    "$schema": {
      "type": "string"
    },
    "_description": {
      "type": "string",
      "description": "Human-readable description of this file."
    },
    "_hierarchy": {
      "type": "string",
      "description": "Documents the nesting structure: marketplaces[source_id][plugin_ref][skill_ref]."
    },
    "_schema_version": {
      "type": "string",
      "description": "Schema version for forward-compatibility checks.",
      "enum": ["1"]
    },
    "marketplace": {
      "type": "object",
      "description": "Optional. Marketplace-level metadata for the generated marketplace.json files. Same structure as the 'marketplace' block in sources/plugins.json.",
      "required": ["name", "owner"],
      "additionalProperties": false,
      "properties": {
        "name": {
          "type": "string",
          "description": "Marketplace identifier (kebab-case). Must be globally unique.",
          "pattern": "^[a-z][a-z0-9-]*$",
          "maxLength": 64
        },
        "owner": {
          "type": "object",
          "required": ["name"],
          "additionalProperties": false,
          "properties": {
            "name":  { "type": "string",  "description": "Name of the maintainer or team." },
            "email": { "type": "string",  "format": "email", "description": "Contact email." },
            "url":   { "type": "string",  "description": "URL of the maintainer or organization." }
          }
        },
        "metadata": {
          "type": "object",
          "additionalProperties": false,
          "properties": {
            "description": { "type": "string" },
            "version":     { "type": "string", "pattern": "^\\d+\\.\\d+\\.\\d+$" },
            "pluginRoot":  { "type": "string" }
          }
        }
      }
    },
    "plugins": {
      "type": "array",
      "description": "Optional. Canonical list of finalized plugins for generation of both marketplace.json output files. Each entry conforms to the pluginEntry schema used by marketplace.json.",
      "items": {
        "$ref": "marketplace.schema.json#/$defs/pluginEntry"
      }
    },
    "marketplaces": {
      "type": "object",
      "description": "Top-level map keyed by source ID (matching an 'id' in sources/marketplaces.json). Each value is a plugin map.",
      "additionalProperties": {
        "$ref": "#/$defs/pluginMap"
      }
    }
  },
  "$defs": {
    "pluginMap": {
      "type": "object",
      "description": "Map of plugin_ref (GitHub 'owner/repo') → skill map.",
      "additionalProperties": {
        "$ref": "#/$defs/skillMap"
      }
    },
    "skillMap": {
      "type": "object",
      "description": "Map of skill_ref (file path within the repo, e.g. 'path/to/SKILL.md') → registry entry.",
      "additionalProperties": {
        "$ref": "#/$defs/entry"
      }
    },
    "entry": {
      "type": "object",
      "description": "Registry entry for a single discovered resource file.",
      "required": ["sha", "last_evaluated", "plugin", "recommendation"],
      "additionalProperties": false,
      "properties": {
        "sha": {
          "type": "string",
          "description": "40-character hex content hash (SHA-256 truncated) used to detect file changes between discovery runs.",
          "pattern": "^[0-9a-f]{40}$"
        },
        "last_evaluated": {
          "type": "string",
          "description": "ISO-8601 UTC timestamp of the last evaluation (e.g. '2026-03-06T05:30:40Z').",
          "format": "date-time"
        },
        "plugin": {
          "type": "string",
          "description": "plugin domain this resource was discovered for (e.g. 'terraformer')."
        },
        "resource_type": {
          "type": "string",
          "description": "The type of resource this entry represents. Set by discover.py; lets consumer scripts know the type without re-parsing the file path.",
          "enum": [
            "agents",
            "commands",
            "hooks",
            "instructions",
            "mcp",
            "plugins",
            "skills",
            "workflows"
          ]
        },
        "lang_tags": {
          "type": "array",
          "description": "Technology/language tags applied to this resource (e.g. ['bash', 'hcl']).",
          "items": {
            "type": "string"
          },
          "uniqueItems": true
        },
        "platform_tags": {
          "type": "array",
          "description": "Platform tags applied to this resource (e.g. ['aws', 'azure']). Bare tags; the 'platform/csp/', 'platform/ci/', 'platform/saas/' prefixes are added by platform_label() when creating GitHub labels.",
          "items": {
            "type": "string"
          },
          "uniqueItems": true
        },
        "score": {
          "type": "object",
          "description": "AI-assigned quality scores (populated after evaluation stage). Empty object while recommendation is 'pending'.",
          "additionalProperties": false,
          "properties": {
            "relevance": {
              "type": "number",
              "description": "How relevant the resource is to the target plugin.",
              "minimum": 0,
              "maximum": 10
            },
            "quality": {
              "type": "number",
              "description": "Quality of the resource content.",
              "minimum": 0,
              "maximum": 10
            },
            "completeness": {
              "type": "number",
              "description": "Completeness of the resource (e.g. required frontmatter, safety instructions).",
              "minimum": 0,
              "maximum": 10
            },
            "platform_fit": {
              "type": "number",
              "description": "How well the resource fits the target platform(s).",
              "minimum": 0,
              "maximum": 10
            },
            "overall": {
              "type": "number",
              "description": "Weighted overall score.",
              "minimum": 0,
              "maximum": 10
            }
          }
        },
        "recommendation": {
          "type": "string",
          "description": "AI evaluation outcome. 'pending' = discovered, not yet scored. 'include' = use as-is. 'enrich' = include with additional context. 'exclude' = do not use.",
          "enum": ["pending", "include", "enrich", "exclude"]
        },
        "issue_number": {
          "description": "GitHub issue number created for this discovery, or null if none was created (e.g. dry-run).",
          "oneOf": [
            {
              "type": "integer",
              "minimum": 1
            },
            {
              "type": "null"
            }
          ]
        },
        "notes": {
          "type": "string",
          "description": "Free-text notes from the discovery or evaluation stage."
        },
        "categories": {
          "type": "array",
          "description": "Optional. One or more skill categories this resource belongs to.",
          "uniqueItems": true,
          "items": {
            "type": "string",
            "enum": [
              "AI Agents",
              "Coding",
              "Data",
              "DevOps",
              "Marketing",
              "Media",
              "Other",
              "Productivity",
              "Security",
              "Writing"
            ]
          }
        }
      }
    }
  }
}
